{
    "name": "Permission",
    "description": "Access Control Permission entry (ACL).",
    "routes": [
        {
            "id": "item.booking.file",
            "label": "Edit permission",
            "description": "",
            "icon": "library_books",
            "route": "/settings/permissions/edit/object.id",
            "context": {
                "entity": "core\\Permission",
                "view": "form.default",
                "domain": ["id", "=", "object.id"],
                "reset": true
            }
        }
    ],
    "layout": {
        "groups": [
            {
                "sections": [
                    {
                        "rows": [
                            {
                                "columns": [
                                    {
                                        "width": "66%",
                                        "align": "left",
                                        "items": [
                                            {
                                                "type": "field",
                                                "value": "class_name",
                                                "width": "50%"
                                            },
                                            {
                                                "type": "label",
                                                "value": "",
                                                "width": "50%"
                                            },
                                            {
                                                "type": "field",
                                                "value": "rights",
                                                "width": "25%"
                                            },
                                            {
                                                "type": "field",
                                                "value": "rights_txt",
                                                "width": "25%"
                                            }
                                        ]
                                    },
                                    {
                                        "id": "column.right",
                                        "width": "33%",
                                        "align": "left",
                                        "items": [
                                            {
                                                "id": "item.group_id",
                                                "type": "field",
                                                "value": "group_id",
                                                "width": "100%",
                                                "widget": {
                                                    "limit": 100
                                                }
                                            },
                                            {
                                                "id": "item.user_id",
                                                "type": "field",
                                                "value": "user_id",
                                                "width": "100%",
                                                "widget": {
                                                    "limit": 100
                                                }
                                            }
                                        ]
                                    }
                                ]
                            }
                        ]
                    }
                ]
            }
        ]
    }
}